{
  "kind": "neutrino.domain-pack",
  "packDigest": "sha256:cf10193c68593e3445dafe02104aa6ea23524e2698168af61377dcd8f6205856",
  "packId": "sponsored_offer_agreement",
  "payloads": [
    {
      "contract": "capability-spec",
      "mediaType": "application/json",
      "path": "generated/capability-spec/capability-spec.json",
      "role": "capability-spec",
      "sha256": "sha256:e741666bbdeb40377b37833e3a3d7ebb574c83e921df204644ee8c0eab079326"
    },
    {
      "mediaType": "application/json",
      "path": "generated/capability/postgres.json",
      "role": "target-capability",
      "sha256": "sha256:2ac5bed676203c25dc5546948b4cd822a17c6a10774e31669c3d1a5189505db6"
    },
    {
      "mediaType": "application/json",
      "path": "generated/capability/solidity.json",
      "role": "target-capability",
      "sha256": "sha256:47c3a4b7045914651be23606c38cb0e95127d96299abf8e90c0ae9ed96f1a5bf"
    },
    {
      "mediaType": "application/json",
      "path": "generated/coverage/coverage.json",
      "role": "coverage-report",
      "sha256": "sha256:af7708a904ffd08a148fbd4bb3d5128c3d372f1e6d67de85a7dd2342ea72d5a3"
    },
    {
      "mediaType": "application/sql",
      "path": "generated/postgres/procedure.sql",
      "role": "postgres-procedure",
      "sha256": "sha256:7f80d0864ef8cde4ef9457a65d11f96e1d9674e98b00d2e9207c60c57979ca0b"
    },
    {
      "mediaType": "application/sql",
      "path": "generated/postgres/reconciliation.sql",
      "role": "postgres-reconciliation",
      "sha256": "sha256:9376545e4d3cef235015c7aca18869e8cef7bace79a7ccc682f82c2e69cace52"
    },
    {
      "mediaType": "application/x-sh",
      "path": "generated/postgres/run_db_test.sh",
      "role": "postgres-test-helper",
      "sha256": "sha256:f1565bb600179ae4411548deb126ec82c8d55aa92d1b73d181a47a3889af2b6c"
    },
    {
      "mediaType": "application/sql",
      "path": "generated/postgres/schema.sql",
      "role": "postgres-schema",
      "sha256": "sha256:a33d99de1cb5d86537c12f12bdb4e940f2bf293bb6536827239b226b3935dce5"
    },
    {
      "mediaType": "application/json",
      "path": "generated/security/security.json",
      "role": "security-report",
      "sha256": "sha256:aea315b0bcc91be762ec35a2e8818305f9ec2891dabd4ad6831ffd2e81eea17a"
    },
    {
      "mediaType": "application/json",
      "path": "generated/slot/binding-topology.json",
      "role": "slot-binding-topology",
      "sha256": "sha256:15ed8c04523380c453a3c5285354e3228a48dfc560c130de1c739b46396270af"
    },
    {
      "mediaType": "application/json",
      "path": "generated/slot/capability.json",
      "role": "slot-capability",
      "sha256": "sha256:0487134b92e0b7aa0265c03f54ed6b36151205633abff5da8772f79138c6cfbb"
    },
    {
      "mediaType": "application/json",
      "path": "generated/slot/capability.lock",
      "role": "slot-capability",
      "sha256": "sha256:5ba3f6bebb1fb169c82b332e25697b7f6d3b80f07e5f03bf27c45ca50939a9c6"
    },
    {
      "mediaType": "application/json",
      "path": "generated/slot/compensation.json",
      "role": "slot-compensation",
      "sha256": "sha256:98ae6b2be53c7391958a647762f405f08116ce89baad0bde9dfed82f15709591"
    },
    {
      "mediaType": "application/json",
      "path": "generated/slot/envelope.example.json",
      "role": "slot-envelope",
      "sha256": "sha256:97ad24476b23c9e913a9011ca8f4e4b024d60a85e622fa843c973f2f1a569cf9"
    },
    {
      "mediaType": "application/json",
      "path": "generated/slot/envelope.schema.json",
      "role": "slot-envelope",
      "sha256": "sha256:6c3907e6ad94b8734f5f209284d6b806d5790dd2bdf5831f3e506eec7e8fc221"
    },
    {
      "mediaType": "application/json",
      "path": "generated/slot/operations.json",
      "role": "slot-operations",
      "sha256": "sha256:615d696c3ee3c1677cc36746b100cc1985c1298cd0e043955c16f239d52cc07d"
    },
    {
      "mediaType": "application/json",
      "path": "generated/slot/transcript.json",
      "role": "slot-transcript",
      "sha256": "sha256:83da491c6364923132e1d61fd6b739809fd06c98aad60cb24d950b7d92d2acaa"
    },
    {
      "mediaType": "application/toml",
      "path": "generated/solidity/foundry.toml",
      "role": "solidity-config",
      "sha256": "sha256:d3755c5f9b2cc7b596bb1dc786a0e5ca9408872e58b3a02a00d831853aa45d6c"
    },
    {
      "mediaType": "text/x-solidity",
      "path": "generated/solidity/src/SponsoredOfferAgreement.sol",
      "role": "solidity-source",
      "sha256": "sha256:924f0e8a7e3130bcc42352f6fa0c28b27e18b701c2cb78548a20e045ec089370"
    },
    {
      "mediaType": "text/x-solidity",
      "path": "generated/solidity/test/SponsoredOfferAgreement.t.sol",
      "role": "solidity-source",
      "sha256": "sha256:bf41ab2373f653d9f5d67fd408c042f1f9a42cbe3bd8ed4bf77aa1e8a21315b9"
    },
    {
      "contract": "test-realization",
      "mediaType": "application/json",
      "path": "generated/test-realization/test-realization.json",
      "role": "test-realization",
      "sha256": "sha256:9c49079197adf20a4ecc08fe1e193095595d6a134a12b3858ca892fcb399a03c"
    },
    {
      "contract": "participant-view",
      "mediaType": "application/json",
      "path": "generated/views/Merchant.json",
      "role": "participant-view",
      "sha256": "sha256:27573148cb71cecad4119ca47ad9504f7cc45f84f4e8360cae54c622e3d00fd9"
    },
    {
      "contract": "participant-view",
      "mediaType": "application/json",
      "path": "generated/views/Sponsor.json",
      "role": "participant-view",
      "sha256": "sha256:19a2648a44a55b59427bfb47baf1e0e61b217c5cc8c0d560be9885d4f6cf5c4f"
    },
    {
      "mediaType": "application/json",
      "path": "scenario/sponsored_offer_agreement_happy_path.json",
      "role": "scenario",
      "sha256": "sha256:0cdbe31b0d16e15acaf6906246e04f7d947d48f1fdd2eabba04527d96ce5bd26"
    },
    {
      "mediaType": "text/x-neutrino",
      "path": "source/sponsored_offer_agreement.neu",
      "role": "source",
      "sha256": "sha256:cbafeb60275627a6d22338ee2b62de139be76fcc30458235d234e7d32a2222bc"
    }
  ],
  "requiredContracts": [
    "capability-spec",
    "participant-view",
    "test-realization"
  ],
  "schemaVersion": 2,
  "targetsBundle": {
    "bundleDigest": "sha256:af5b29b92b55586b6aea7d59b6d9c9d8aa510a39539e5c2e3a8afb18669087a2",
    "bundleId": "neutrino.core-contract-bundle",
    "bundleVersion": "1.10.0"
  }
}
