{
  "kind": "neutrino.domain-pack",
  "packDigest": "sha256:fe91a701e8af29fbe7114fe51eba871bc90a149a74fc6d1ca95f367c04f9ab51",
  "packId": "contested_evidence_resolution",
  "payloads": [
    {
      "contract": "capability-spec",
      "mediaType": "application/json",
      "path": "generated/capability-spec/capability-spec.json",
      "role": "capability-spec",
      "sha256": "sha256:c0243758bb28c893c049d251e32fa2df32b918ce61efd64817505c3f70c85b68"
    },
    {
      "mediaType": "application/toml",
      "path": "generated/solidity/foundry.toml",
      "role": "solidity-config",
      "sha256": "sha256:d3755c5f9b2cc7b596bb1dc786a0e5ca9408872e58b3a02a00d831853aa45d6c"
    },
    {
      "mediaType": "text/x-solidity",
      "path": "generated/solidity/src/ContestedEvidenceResolution.sol",
      "role": "solidity-source",
      "sha256": "sha256:9f9036b45a9aa7d16532482e1fc61ff0217857b23e7b26426045e9b7f5eae313"
    },
    {
      "mediaType": "text/x-solidity",
      "path": "generated/solidity/src/ThresholdQuorumAcceptance.sol",
      "role": "solidity-source",
      "sha256": "sha256:32ea1c5219a56f185f037296a898df7430c52752ea40423075ec0d23b987682a"
    },
    {
      "mediaType": "text/x-solidity",
      "path": "generated/solidity/test/ContestedEvidenceResolution.t.sol",
      "role": "solidity-source",
      "sha256": "sha256:b0986f11cd3f22ea867f3c836d34f1efaa0cc84d54128be114ca07b8538eafdb"
    },
    {
      "mediaType": "application/json",
      "path": "scenario/contested_evidence_resolution_quorum_accepted.json",
      "role": "scenario",
      "sha256": "sha256:207e4b00c8226ce9e83be796a4277d736e70f5f5a392b8b59e507ca6790c7549"
    },
    {
      "mediaType": "text/x-neutrino",
      "path": "source/contested_evidence_resolution.neu",
      "role": "source",
      "sha256": "sha256:5ca28f11407a862dec666fdab6840d8f443f435c1a43603e9dd62f03e2cadf93"
    }
  ],
  "requiredContracts": [
    "capability-spec"
  ],
  "schemaVersion": 2,
  "targetsBundle": {
    "bundleDigest": "sha256:af5b29b92b55586b6aea7d59b6d9c9d8aa510a39539e5c2e3a8afb18669087a2",
    "bundleId": "neutrino.core-contract-bundle",
    "bundleVersion": "1.10.0"
  }
}
